
Cluster Transfer Optimizer
======================================================================
Samples: 80, Workers: 7
Fevals: full=20/36, transfer=10
Sigma: full=0.15/0.2, transfer=0.08
Clusters: 1-src=4, 2-src=6
Fallback threshold: 1-src=0.35, 2-src=0.45
======================================================================

[Phase 1] Clustering samples...
  Created 10 clusters, 10 representatives

[Phase 2] Optimizing 10 representatives...
  Rep sample   2: 1-src RMSE=0.0343 time=25.0s [OK]
  Rep sample  19: 1-src RMSE=0.1017 time=35.6s [OK]
  Rep sample  18: 1-src RMSE=0.1213 time=36.3s [OK]
  Rep sample  31: 1-src RMSE=0.1000 time=24.1s [OK]
  Rep sample  45: 2-src RMSE=0.2058 time=67.6s [OK]
  Rep sample  44: 2-src RMSE=0.1007 time=68.6s [OK]
  Rep sample  75: 2-src RMSE=0.1184 time=84.9s [OK]
  Rep sample  38: 2-src RMSE=0.1530 time=99.9s [OK]
  Rep sample  63: 2-src RMSE=0.2082 time=67.2s [OK]
  Rep sample  52: 2-src RMSE=0.1994 time=95.0s [OK]

[Phase 3] Optimizing 70 samples with transfer...
[ 11/80] Sample   4: 1-src RMSE=0.1544 sims= 43 time=19.6s [OK][T]
[ 12/80] Sample   1: 1-src RMSE=0.1025 sims= 43 time=19.8s [OK][T]
[ 13/80] Sample   3: 1-src RMSE=0.3285 sims= 43 time=25.4s [OK][T]
[ 14/80] Sample   6: 1-src RMSE=0.3106 sims= 43 time=25.4s [OK][T]
[ 15/80] Sample   5: 1-src RMSE=0.2441 sims= 44 time=25.7s [OK][T]
[ 16/80] Sample   0: 1-src RMSE=0.1174 sims= 44 time=25.9s [OK][T]
[ 17/80] Sample   8: 1-src RMSE=0.0981 sims= 43 time=23.0s [OK][T]
[ 18/80] Sample  12: 1-src RMSE=0.1810 sims= 43 time=20.1s [OK][T]
[ 19/80] Sample   9: 1-src RMSE=0.2247 sims= 44 time=26.8s [OK][T]
[ 20/80] Sample   7: 1-src RMSE=0.4103 sims= 87 time=55.3s [OK][T]
[ 21/80] Sample  10: 1-src RMSE=0.1533 sims= 43 time=32.0s [OK][T]
[ 22/80] Sample  11: 1-src RMSE=0.0457 sims= 44 time=32.7s [OK][T]
[ 23/80] Sample  13: 1-src RMSE=0.0700 sims= 44 time=33.0s [OK][T]
[ 24/80] Sample  16: 1-src RMSE=0.1606 sims= 44 time=25.9s [OK][T]
[ 25/80] Sample  14: 1-src RMSE=0.1670 sims= 42 time=28.9s [OK][T]
[ 26/80] Sample  15: 1-src RMSE=0.3318 sims= 43 time=33.6s [OK][T]
[ 27/80] Sample  20: 1-src RMSE=0.0128 sims= 44 time=22.8s [OK][T]
[ 28/80] Sample  21: 1-src RMSE=0.1856 sims= 42 time=22.1s [OK][T]
[ 29/80] Sample  17: 1-src RMSE=0.1003 sims= 44 time=35.8s [OK][T]
[ 30/80] Sample  22: 1-src RMSE=0.1442 sims= 44 time=37.6s [OK][T]
[ 31/80] Sample  24: 1-src RMSE=0.1906 sims= 43 time=25.7s [OK][T]
[ 32/80] Sample  25: 1-src RMSE=0.1864 sims= 44 time=26.3s [OK][T]
[ 33/80] Sample  26: 1-src RMSE=0.1807 sims= 43 time=25.8s [OK][T]
[ 34/80] Sample  23: 1-src RMSE=0.1021 sims= 43 time=33.8s [OK][T]
[ 35/80] Sample  27: 1-src RMSE=0.1562 sims= 42 time=39.1s [OK][T]
[ 36/80] Sample  29: 1-src RMSE=0.0992 sims= 42 time=28.2s [OK][T]
[ 37/80] Sample  30: 1-src RMSE=0.1150 sims= 42 time=32.2s [OK][T]
[ 38/80] Sample  28: 1-src RMSE=0.1059 sims= 87 time=46.8s [OK][T]
[ 39/80] Sample  33: 2-src RMSE=0.3108 sims=106 time=60.6s [OK][T]
[ 40/80] Sample  35: 2-src RMSE=0.3051 sims=104 time=59.3s [OK][T]
[ 41/80] Sample  32: 2-src RMSE=0.2291 sims=104 time=72.8s [OK][T]
[ 42/80] Sample  37: 2-src RMSE=0.2424 sims=106 time=61.0s [OK][T]
[ 43/80] Sample  39: 2-src RMSE=0.3963 sims=104 time=59.3s [OK][T]
[ 44/80] Sample  36: 2-src RMSE=0.1490 sims=106 time=87.4s [OK][T]
[ 45/80] Sample  40: 2-src RMSE=0.2868 sims=102 time=58.3s [OK][T]
[ 46/80] Sample  41: 2-src RMSE=0.1759 sims=104 time=56.5s [OK][T]
[ 47/80] Sample  43: 2-src RMSE=0.2595 sims=104 time=57.8s [OK][T]
[ 48/80] Sample  42: 2-src RMSE=inf sims=  0 time=92.2s [ERR][T]
[ 49/80] Sample  47: 2-src RMSE=0.1228 sims=104 time=58.9s [OK][T]
[ 50/80] Sample  34: 2-src RMSE=0.3099 sims=266 time=165.1s [OK][T]
[ 51/80] Sample  48: 2-src RMSE=inf sims=  0 time=57.7s [ERR][T]
[ 52/80] Sample  46: 2-src RMSE=0.2704 sims=104 time=88.5s [OK][T]
[ 53/80] Sample  49: 2-src RMSE=0.1856 sims=102 time=59.0s [OK][T]
[ 54/80] Sample  54: 2-src RMSE=0.2647 sims=106 time=57.5s [OK][T]
[ 55/80] Sample  51: 2-src RMSE=inf sims=  0 time=60.0s [ERR][T]
[ 56/80] Sample  55: 2-src RMSE=0.2031 sims=106 time=59.7s [OK][T]
[ 57/80] Sample  56: 2-src RMSE=0.1622 sims=108 time=90.4s [OK][T]
[ 58/80] Sample  50: 2-src RMSE=0.5305 sims=268 time=133.7s [OK][T]
[ 59/80] Sample  59: 2-src RMSE=0.0170 sims=108 time=63.0s [OK][T]
[ 60/80] Sample  60: 2-src RMSE=0.1686 sims=106 time=58.5s [OK][T]
[ 61/80] Sample  53: 2-src RMSE=0.0041 sims=266 time=137.2s [OK][T]
[ 62/80] Sample  58: 2-src RMSE=0.2260 sims=104 time=86.1s [OK][T]
[ 63/80] Sample  61: 2-src RMSE=0.1289 sims=104 time=59.3s [OK][T]
[ 64/80] Sample  64: 2-src RMSE=0.1332 sims=104 time=58.5s [OK][T]
[ 65/80] Sample  57: 2-src RMSE=0.4562 sims=268 time=172.6s [OK][T]
[ 66/80] Sample  62: 2-src RMSE=0.3577 sims=104 time=84.9s [OK][T]
[ 67/80] Sample  66: 2-src RMSE=0.4079 sims=104 time=61.1s [OK][T]
[ 68/80] Sample  65: 2-src RMSE=0.3402 sims=106 time=92.4s [OK][T]
[ 69/80] Sample  68: 2-src RMSE=0.1735 sims=106 time=61.3s [OK][T]
[ 70/80] Sample  67: 2-src RMSE=0.3518 sims=104 time=91.2s [OK][T]
[ 71/80] Sample  71: 2-src RMSE=0.3367 sims=104 time=57.8s [OK][T]
[ 72/80] Sample  70: 2-src RMSE=0.1343 sims=106 time=61.6s [OK][T]
[ 73/80] Sample  72: 2-src RMSE=0.2491 sims=108 time=63.6s [OK][T]
[ 74/80] Sample  69: 2-src RMSE=inf sims=  0 time=94.0s [ERR][T]
[ 75/80] Sample  74: 2-src RMSE=0.2857 sims=106 time=62.8s [OK][T]
[ 76/80] Sample  73: 2-src RMSE=0.2708 sims=104 time=75.5s [OK][T]
[ 77/80] Sample  77: 2-src RMSE=0.4157 sims=106 time=58.0s [OK][T]
[ 78/80] Sample  79: 2-src RMSE=0.2511 sims=104 time=55.6s [OK][T]
[ 79/80] Sample  76: 2-src RMSE=0.1886 sims=104 time=87.1s [OK][T]
[ 80/80] Sample  78: 2-src RMSE=inf sims=  0 time=85.9s [ERR][T]

======================================================================
RESULTS: Cluster Transfer Optimizer
======================================================================
RMSE:             0.204302
Submission Score: 1.0334
Total Time:       734.8s (12.2 min)
Projected (400):  61.2 min

  1-source: RMSE=0.1574 (n=32)
  2-source: RMSE=0.2392 (n=43)

Clustering stats:
  Representatives: 10 samples (full optimization)
  Transfer samples: 70 samples (reduced optimization)
  Transfer init used: 17 samples

Time breakdown:
  Representative phase: 604.3s
  Transfer phase: 4053.0s

Target: Same score with 20%+ time reduction
Baseline (robust_fallback): 1.1247 @ 57.2 min
This cluster run:           1.0334 @ 61.2 min
Delta:                      -0.0913 score, +4.0 min

STATUS: FAILED - Over budget by 1.2 min
======================================================================


High RMSE samples (6):
  Sample 42: 2-src RMSE=inf sims=0     
  Sample 48: 2-src RMSE=inf sims=0     
  Sample 51: 2-src RMSE=inf sims=0     
  Sample 69: 2-src RMSE=inf sims=0     
  Sample 78: 2-src RMSE=inf sims=0     
  Sample 50: 2-src RMSE=0.5305 sims=268     
